{
  "$schema": "../brand-pack.schema.json",
  "version": 1,
  "source": {
    "url": "https://example.com",
    "capturedAt": "YYYY-MM-DD",
    "method": "manual",
    "notes": "Fill style fields only. Landing copy is shared boilerplate."
  },
  "identity": {
    "name": "Brand Name",
    "siteUrl": "https://example.com"
  },
  "colors": {
    "background": "#ffffff",
    "foreground": "#111111",
    "primary": "#111111",
    "accent": "#111111",
    "provenance": {
      "background": "manual",
      "foreground": "manual",
      "primary": "manual",
      "accent": "manual (same as primary until a distinct accent is known)"
    }
  },
  "typography": {
    "fontFamily": "Inter"
  },
  "assets": {
    "logo": "./assets/logo.png",
    "favicon": "./assets/favicon.ico"
  },
  "landing": {
    "variant": "light-hero"
  }
}
